{
  "schema_version": "0.1.0",
  "id": "diagnostics",
  "name": "Diagnostic Service Request Test Generation",
  "version": "0.1.0",
  "status": "active",
  "owner": "workflow",
  "domains": ["diagnostics", "uds"],
  "compatible_canoe_versions": ["v15"],
  "depends_on_packs": ["core", "team_eq07"],
  "files": {
    "scenarios": "packs/diagnostics/scenarios.json",
    "retrieval_profile": "packs/diagnostics/retrieval_profile.json",
    "validation_rules": "packs/diagnostics/validation_rules.json"
  },
  "provided_capabilities": ["diagnostic request", "diagnostic response check"]
}

